_unit_id,_golden,_unit_state,_trusted_judgments,_last_judgment_at,what_is_the_function_of_this_citation,what_is_the_function_of_this_citation:confidence,article,current,link,marker,next,previous,what_is_the_function_of_this_citation_gold
1157166537,false,finalized,3,2/12/2017 17:00:34,Pos,1.0,P96-1026,"Our analysis was carried out within the framework of Systemic-Functional Linguistics (sFL) (Halliday, 1978; Halliday, 1985) which views language as a resource for the creation of meaning.",http://www.aclweb.org/anthology/P/P96/P96-1026.pdf,"(Halliday, 1978",SFL stratifies meaning into context and language.,3 Linguistic Framework: Systemic Functional Linguistics,
1157166538,false,finalized,3,2/12/2017 16:34:53,Neut,0.6575,P96-1026,"It certainly conforms to the principles of good documentation established by current research on technical documentation and on the needs of end-users, e.g., (Carroll, 1994; Hammond, 1994), in that it supplies clear and concise information for the task at hand.",http://www.aclweb.org/anthology/P/P96/P96-1026.pdf,"(Carroll, 1994","Finally, we have been assured by French users of the software that they consider this particular manual to be well written and to bear no unnatural trace of its origins.","Furthermore, we know that Macintosh documentation undergoes thorough local quality control.",
1157166539,false,finalized,3,2/12/2017 16:38:45,Pos,0.6627,P96-1026,"We have looked to the construct of genre (Martin, 1992) to provide this additional control, on two grounds: (1) since genres are distinguished by their communicative purposes, we can view each of the functional sections already identified as a distinct genre; (2) genre is presented as controlling text structure and realisation.",http://www.aclweb.org/anthology/P/P96/P96-1026.pdf,"(Martin, 1992)","In Martin's view, genre is defined as a staged, goal-oriented social process realised through register, the context of situation, which in turn is realised in language to achieve the goals of a text.","In such cases, we must appeal to another source of control over the apparently available choices.",
1157166540,false,finalized,3,2/12/2017 18:16:57,Neut,0.6505,P96-1026,"This is consistent with other accounts of text structure for text generation in technical domains, e.g., (McKeown, 1985; Paris, 1993; Kittredge et al., 1991).",http://www.aclweb.org/anthology/P/P96/P96-1026.pdf,"(McKeown, 1985","For those cases where the realisation remains under-determined by the task element type, we conducted a finer-grained analysis, by overlaying a genre partition on the undifferentiated data.","It will also allow us to determine the text structures appropriate in each genre, a study we are currently undertaking.",
1157166541,false,finalized,3,2/12/2017 16:41:50,CoCo,0.6828,P96-1026,"The results from our linguistic analysis are consistent with other research on sublanguages in the instructions domain, in both French and English, e.g., (Kosseim and Lapalme, 1994; Paris and Scott, 1994).",http://www.aclweb.org/anthology/P/P96/P96-1026.pdf,"(Kosseim and Lapalme, 1994",Our analysis goes beyond previous work by identifying within the discourse context the means for exercising explicit control over a text generator.,9 Related Work,
1157166542,false,finalized,4,2/12/2017 16:19:44,Pos,0.5063,P96-1026,"An interesting difference with respect to previous descriptions is the use of the true (or direct) imperative to express an action in the procedure genre, as results from (Paris and Scott, 1994) seem to indicate that the infinitive-form of the imperative is preferred in French.",http://www.aclweb.org/anthology/P/P96/P96-1026.pdf,"(Paris and Scott, 1994)","These results, however, were obtained from a corpus of instructions mostly for domestic appliances as opposed to software manuals.",Our analysis goes beyond previous work by identifying within the discourse context the means for exercising explicit control over a text generator.,
1157166543,false,finalized,3,2/12/2017 16:37:33,Weak,0.6766,P96-1026,"Furthermore the use of the infinitive-form in instructions in general as observed by (Kocourek, 1982) is declining, as some of the conventions already common in English technical writing are being adopted by French technical writers, e.g., (Timbal-Duclaux, 1990).",http://www.aclweb.org/anthology/P/P96/P96-1026.pdf,"(Kocourek, 1982)","We also note that the patterns of realisations uncovered in our analysis follow the principle of good technical writing practice known as the minimalist approach, e.g., (Carroll, 1994; Hammond, 1994).","These results, however, were obtained from a corpus of instructions mostly for domestic appliances as opposed to software manuals.",
1157166544,false,finalized,3,2/12/2017 16:40:00,CoCo,0.6809,P96-1026,"The methodology we employed is similar to that endorsed by (Biber, 1995).",http://www.aclweb.org/anthology/P/P96/P96-1026.pdf,"(Biber, 1995)",It is summarised as follows:,2 Methodology,
1157166545,false,finalized,4,2/12/2017 16:21:45,Neut,1.0,W06-2204,"TPLEX is a transductive algorithm (Vapnik, 1998), in that the goal is to perform extraction from a given unlabelled corpus, given a labelled corpus.",http://www.aclweb.org/anthology/W/W06/W06-2204.pdf,"(Vapnik, 1998)","This is in contrast to the typical machine learning framework, where the goal is a set of extraction patterns (which can of course then be applied to new unlabelled text).","Rather than relying on redundancy of the fragments, TPLEX exploits redundancy of the learned extraction patterns.",
1157166546,false,finalized,4,2/12/2017 16:19:44,Neut,0.5635,W06-2204,"Another possibility is to explore semi-supervised extensions to boosting (d'Alche Buc et al., 2002).",http://www.aclweb.org/anthology/W/W06/W06-2204.pdf,"Alche Buc et al., 2002)","Boosting is a highly effective ensemble learning technique, and BWI uses boosting to tune the weights of the learned patterns, so if we generalize boosting to handle unlabelled data, then the learned weights may well be more effective than those calculated by TPLEX.",It remains to be seen whether this approach would be effective for information extraction.,
1157166547,false,finalized,3,2/12/2017 16:38:27,CoCo,1.0,W06-2204,"TPLEX's boundary detectors are similar to those learned by BWI (Freitag and Kushmerick, 2000).",http://www.aclweb.org/anthology/W/W06/W06-2204.pdf,"(Freitag and Kushmerick, 2000)","A boundary detector has two parts, a left pattern and a right pattern.","This strategy has previously been employed successfully (Freitag and Kushmerick, 2000; Ciravegna, 2001; Yangarber et al., 2002; Finn and Kushmerick, 2004).",
1157166548,false,finalized,3,2/12/2017 16:43:25,Pos,1.0,W06-2204,"For the CRF results, we used MALLET's SimpleTagger (McCallum, 2002), with each token encoded with a set of binary features (one for each observed literal, as well as the eight token generalizations).",http://www.aclweb.org/anthology/W/W06/W06-2204.pdf,"(McCallum, 2002)",Our results in Fig.,The results for ELIE were generated by the current implementation [http://smi.ucd.ie/aidan/Software.html].,
1157166549,false,finalized,3,2/12/2017 16:41:48,Neut,1.0,W15-2134,Schwartz et al (2012) is a systematic study of how representation choices in dependency annotation schemes affect their learnability for parsing.,http://www.aclweb.org/anthology/W/W15/W15-2134.pdf,(2012),"The choice points investigated, much like in the current paper, relate to the issue of headedness.",2 Related work,
1157166550,false,finalized,3,2/12/2017 16:42:15,CoCo,0.6553,W15-2134,"In terms of LAS, MaltParser (Nivre et al., 2007) performs best of the 3 parsers with SD, and MSTParser (McDonald et al., 2006) performs best with CoNLL.",http://www.aclweb.org/anthology/W/W15/W15-2134.pdf,"(Nivre et al., 2007)","In Nilsson et al (2006), the authors investigate the effects of two types of input transformation on the performance of MaltParser.","For all parsers and in most experiments (which explore several pipelines with different POS-tagging strategies), SD is easier to label (i.e., label accuracy scores are higher) and CoNLL is easier to structure (i.e., unlabeled attachment scores are higher).",
1157166551,false,finalized,4,2/12/2017 16:29:28,Neut,0.7424,W15-2134,"The first version annotated with the UD representation was released in 2015 (Nivre et al., 2015)1.",http://www.aclweb.org/anthology/W/W15/W15-2134.pdf,"(Nivre et al., 2015)",1http://universaldependencies.github.io/docs/,The result is the first human-checked largescale gold standard for syntactic dependency annotation of English text.,
1157166552,false,finalized,5,2/12/2017 16:27:27,Weak,0.6027,W15-2134,This creates an opportunity for losses that did not exist in the experiments of Schwartz et al (2012).,http://www.aclweb.org/anthology/W/W15/W15-2134.pdf,(2012),7 Conclusion,"Here, since the main concern is the design of a parsing representation that is meant simply as an intermediary step, all output has to be evaluated against the same gold standard.",
1157166553,false,finalized,4,2/12/2017 16:21:45,Pos,0.5063,S15-2109,"Indeed, if we look at the best performing systems from SemEval 2014 (Zhu et al., 2014), (Malandrakis et al., 2014), both make extensive use of these resources, including hundreds of thousands of features, special treatment for negation, multi-word expressions or special strings like emoticons.",http://www.aclweb.org/anthology/S/S15/S15-2109.pdf,"(Zhu et al., 2014)","In this paper we present the INESC-ID system for the 2015 SemEval message polarity classification task (Rosenthal et al., 2015).","However, state-of-the-art systems still largely depend on linguistic resources, extensive feature engineering and tuning.",
1157166554,false,finalized,3,2/12/2017 16:41:49,CoCo,0.6671,S15-2109,"Training employed conventional Stochastic Gradient Descent (Rumelhart et al., 1985) with mini-batch size 1 and random uniform initialization similar to (Glorot and Bengio, 2010).",http://www.aclweb.org/anthology/S/S15/S15-2109.pdf,"(Rumelhart et al., 1985)","After some initial experiments, it was determined that a learning rate of 0.01 and selecting the model with the best accuracy on the 20% set after 8 iterations led to the best results.","The parameters of subspace model in Equation 2, S and C were estimated to minimize the negative log-likelihood of the correct class.",
1157166555,false,finalized,4,2/12/2017 16:13:59,Pos,1.0,S15-2109,"We used the corpus of 52 million tweets used in (Owoputi et al., 2013) with the tokenizer described in the same work.",http://www.aclweb.org/anthology/S/S15/S15-2109.pdf,"(Owoputi et al., 2013)",The words that occurred less than 40 times in the data were discarded from the vocabulary.,"The embedding matrix E was trained in unsupervised fashion using the structured skip-gram model, described in Section 2.",
1157166556,false,finalized,3,2/12/2017 16:33:33,Pos,1.0,S15-2109,"To train the model, we used a negative sampling rate of 25 words, sampled from a multinomial of unigram word probabilities over all the vocabulary (Goldberg and Levy, 2014).",http://www.aclweb.org/anthology/S/S15/S15-2109.pdf,"(Goldberg and Levy, 2014)","Embeddings of 50, 200, 400 and 600 dimensions were trained.",The words that occurred less than 40 times in the data were discarded from the vocabulary.,
1157166557,false,finalized,4,2/12/2017 16:29:28,Neut,1.0,E09-1091,"In Cross-Language Information Retrieval (CLIR) systems, they play an even more important role as the accuracy of their transliterations is shown to correlate highly with the performance of the CLIR systems (Mandl and Womser-Hacker, 2005, Xu and Weischedel, 2005).",http://www.aclweb.org/anthology/E/E09/E09-1091.pdf,"(Mandl and Womser-Hacker, 2005, ",Traditional methods for transliterations have not proven to be very effective in CLIR.,Named Entities (NEs) play a critical role in many Natural Language Processing and Information Retrieval (IR) tasks.,
1157166558,false,finalized,3,2/12/2017 16:41:50,CoCo,0.6647,E09-1091,"We show that MINT's performance is significantly better than a state of the art method (Klementiev and Roth, 2006).",http://www.aclweb.org/anthology/E/E09/E09-1091.pdf,"(Klementiev and Roth, 2006)","Proceedings of the 12th Conference of the European Chapter of the ACL, pages 799-807, Athens, Greece, 30 March - 3 April 2009. c2009 Association for Computational Linguistics","We demonstrate MINT's effectiveness on 4 language pairs involving 5 languages (English, Hindi, Kannada, Russian, and Tamil) from 3 different language families, and its scalability on corpora of vastly different sizes (2,000 to 200,000 articles).",
1157166559,false,finalized,3,2/12/2017 16:41:48,Neut,1.0,E09-1091,"News stories are typically rich in NEs and therefore, comparable news corpora can be expected to contain NETEs (Klementiev and Roth, 2006; Tao et al., 2006).",http://www.aclweb.org/anthology/E/E09/E09-1091.pdf,"(Klementiev and Roth, 2006","The large quantity and the perpetual availability of news corpora in many of the world's languages, make mining of NETEs a viable alternative to traditional approaches.","The ubiquitous availability of comparable news corpora in multiple languages suggests a promising alternative to Machine Transliteration, namely, the mining of Named Entity Transliteration Equivalents (NETEs) from such corpora.",
1157166560,false,finalized,5,2/12/2017 16:27:27,CoCo,0.6027,E09-1091,"In order to address this problem, different kinds of approaches have been taken, from learning transformation rules from dictionaries and applying the rules to find cross-lingual spelling variants (Pirkola et al., 2003), to learning translation lexicon from monolingual and/or comparable corpora (Fung, 1995; Al-Onaizan and Knight, 2002; Koehn and Knight, 2002; Rapp, 1996).",http://www.aclweb.org/anthology/E/E09/E09-1091.pdf,"(Pirkola et al., 2003)","While these works have focused on finding translation equivalents of all class of words, we focus specifically on transliteration equivalents of NEs.","The limited coverage of dictionaries has been recognized as a problem in CLIR and MT (Demner-Fushman & Oard, 2002; Mandl & Womser-hacker, 2005; Xu &Weischedel, 2005).",
1157166561,false,finalized,3,2/12/2017 16:43:36,Neut,0.6607,E09-1091,"NETE discovery from comparable corpora using time series and transliteration model was proposed in (Klementiev and Roth, 2006), and extended for NETE mining for several languages in (Saravanan and Kumaran, 2007).",http://www.aclweb.org/anthology/E/E09/E09-1091.pdf,"(Klementiev and Roth, 2006)","However, such methods miss vast majority of the NETEs due to their dependency on frequency signatures.","In contrast, our approach mines NETEs from article pairs that may not even have any parallel or nearly parallel sentences.",
1157166562,false,finalized,3,2/12/2017 16:33:33,Weak,0.6657,E09-1091,"NETE mining from comparable corpora using phonetic mappings was proposed in (Tao et al., 2006), but the need for language specific knowledge restricts its applicability across languages.",http://www.aclweb.org/anthology/E/E09/E09-1091.pdf,"(Tao et al., 2006)","We proposed the idea of mining NETEs from multilingual articles with similar content in (Udupa, et al., 2008).","In addition, (Klementiev and Roth, 2006) may not scale for large corpora, as they examine every word in the target side as a potential transliteration equivalent.",
1157166563,false,finalized,6,2/12/2017 16:27:17,Neut,0.5485,N12-1038,"Georgescul et al (2009) note that while WindowDiff technically penalizes false positives and false negatives equally, false positives are in fact more likely; a false positive error occurs anywhere were there are more computed boundaries than boundaries in the reference, while a false negative error can only occur when a boundary is missed.",http://www.aclweb.org/anthology/N/N12/N12-1038.pdf,(2009),"Consider figure 1, only 3 of the 8 windows contain a boundary; only those 3 windows may have false negatives (a missed boundary), while all other windows may contain false positives (too many boundaries).","Tasks requiring a uniform theme in a segment might tolerate false positives, while tasks requiring complete ideas or complete themes might accept false negatives.",
1157166564,false,finalized,3,2/12/2017 16:42:15,Pos,0.6657,P06-1009,"We use a conditional random field (CRF) sequence model, which allows for globally optimal training and decoding (Lafferty et al., 2001).",http://www.aclweb.org/anthology/P/P06/P06-1009.pdf,"(Lafferty et al., 2001)",The inference algo,This paper presents an alternative discriminative method for word alignment.,
1157166565,false,finalized,3,2/12/2017 16:33:33,Pos,1.0,P06-1009,"We use L-BFGS, an iterative quasi-Newton optimisation method, which performs well for training log-linear models (Malouf, 2002; Sha and Pereira, 2003).",http://www.aclweb.org/anthology/P/P06/P06-1009.pdf,"(Malouf, 2002",Each L-BFGS iteration requires the objective value and its gradient with respect to the model parameters.,"While the log-likelihood cannot be maximised for the parameters, A, in closed form, it is a convex function, and thus we resort to numerical optimisation to find the globally optimal parameters.",
1157166566,false,finalized,3,2/12/2017 16:38:27,CoCo,0.6782,P06-1009,"We use a similar graphical structure to the directed hidden Markov model (HMM) from GIZA++ (Och and Ney, 2003).",http://www.aclweb.org/anthology/P/P06/P06-1009.pdf,"(Och and Ney, 2003)","This models one-to-many alignments, where each target word is aligned with zero or more source words.","Furthermore, the model allows regularisation using a prior over the parameters, a very effective and simple method for limiting over-fitting.",
1157166567,false,finalized,5,2/12/2017 16:29:53,Pos,0.8315,P06-1009,We use the refined method from Och and Ney (2003) which starts from the intersection of the two models' predictions and 'grows' the predicted alignments to neighbouring alignments which only appear in the output of one of the models.,http://www.aclweb.org/anthology/P/P06/P06-1009.pdf,(2003),4 Experiments,"In order to produce many-to-many alignments we combine the outputs of two models, one for each translation direction.",
1157166568,false,finalized,3,2/12/2017 16:41:50,Pos,1.0,P06-1009,"For parameter tuning, we used the 17 sentence trial set from the Romanian-English corpus in the 2003 NAACL task (Mihalcea and Pedersen, 2003).",http://www.aclweb.org/anthology/P/P06/P06-1009.pdf,"(Mihalcea and Pedersen, 2003)","For this task we have used the same test data as the competition entrants, and therefore can directly compare our results.","We used the original 37 sentence trial set for feature used these as our training and test sets, respectively.",
1157166569,false,finalized,3,2/12/2017 16:41:43,Pos,1.0,P06-1009,We follow Taskar et al (2005) by using the first 100 test sentences for training and the remaining 347 for testing.,http://www.aclweb.org/anthology/P/P06/P06-1009.pdf,(2005),"This means that our results should not be directly compared to those entrants, other than in an approximate manner.","Unlike the unsupervised entrants in the 2003 task, we require word-aligned training data, and therefore must cannibalise the test set for this purpose.",
1157166570,false,finalized,3,2/12/2017 16:29:17,Neut,0.7082,J98-3009,"After reviewing those that were employed by the Automatic Language Processing Advisory Committee (1966) and those that were designed in the early 1990s on behalf of ARPA, a major U.S. funding agency, the author concludes that translation quality cannot be defined in the abstract, mainly because there is no such thing as ""the correct translation,"" and pleads for an evaluation that explicitly takes into account the specific purpose for which a translation has been made.",http://www.aclweb.org/anthology/J/J98/J98-3009.pdf,(1966),"Now that I have gone through the individual papers, the obvious question is how much they contribute to the overall goal of the book, i.e., to help build a bridge between MT and translation theory.","251-263) is actually an exercise in metaevaluation, for the object of her evaluation is not any (group of) MT systems, but rather the criteria in terms of which MT systems are commonly evaluated.",
1157166571,false,finalized,3,2/12/2017 16:40:00,Neut,1.0,P15-2128,"Banea et al (2008) follow this approach, translating an annotated corpus via MT.",http://www.aclweb.org/anthology/P/P15/P15-2128.pdf,(2008),Balamurali et al (2012) use linked Wordnets to,The corpus transfer approach consists of transferring a source training corpus into the target language and building a corpus-based classifier in the target language.,
1157166572,false,finalized,3,2/12/2017 17:00:34,Pos,1.0,P15-2128,"We performed the experiments with the weka toolkit (Hall et al., 2009), using a filter to convert strings into word vectors, and two learning algorithms: SVMs and bagging with Fast Decision Tree Learner as base algorithm.",http://www.aclweb.org/anthology/P/P15/P15-2128.pdf,"(Hall et al., 2009)",Figure 4 represents the experiments conducted with the EN test set.,bels.,
1157166573,false,finalized,3,2/12/2017 17:52:36,Pos,0.6346,P15-2128,"However, Balahur and Turchi (2014) conclude that MT systems can be used to build sentiment analysis systems that can obtain comparable performances to the one obtained for English.",http://www.aclweb.org/anthology/P/P15/P15-2128.pdf,(2014),All this work was performed at sentence or document level.,"In language pairs in which no high-quality MT systems are available, MT may not be an appropriate transfer method (Popat et al., 2013; Balamurali et al., 2012).",
1157166574,false,finalized,3,2/12/2017 16:35:14,Pos,0.6987,P15-2128,"We use the Moses statistical MT (SMT) toolkit (Koehn et al., 2007) to perform the translation.",http://www.aclweb.org/anthology/P/P15/P15-2128.pdf,"(Koehn et al., 2007)","In Moses, these reordering constraints are implemented with the zone and wall tags, as indicated in Figure 3.","That is, the text between the relevant segment boundaries is not reordered nor mixed with the text outside these boundaries.3 Thus the text in the target language segment comes only from the corresponding source language segment.",
1157166575,false,finalized,4,2/12/2017 16:29:28,Pos,1.0,P15-2128,"We used Moses Experiment Management System (Koehn, 2010) with all default options to build the SMT system.7 Because the common crawl corpus contained English sentences in the Spanish side, we applied an LM-based filter to select only sentence pairs in which the Spanish side was better scored by the Spanish LM than with the English LM, and conversely for the English side.",http://www.aclweb.org/anthology/P/P15/P15-2128.pdf,"(Koehn, 2010)",We conducted supervised sentiment classification experiments for settings a and b of use case I (see Section 2).,The LM was an interpolation of LMs trained with the target part of the parallel corpora and with the rest of the Booking and Trip Advisor data (last 2 rows of Table 2).,
1157166576,false,finalized,5,2/12/2017 16:29:53,Neut,0.6047,W97-0318,"The ability to distinguish states, e.g., ""Mark seems happy,"" from events, e.g., ""Renee ran down the street,"" is a necessary prerequisite for interpreting certain adverbial adjuncts, as well as identifying temporal constraints between sentences in a discourse (Moens and Steedman, 1988; Dorr, 1992; Klavans, 1994).",http://www.aclweb.org/anthology/W/W97/W97-0318.pdf,"(Moens and Steedman, 1988","Furthermore, stativity is the first of three fundamental temporal distinctions that compose the aspectual class of a clause.",1 Introduction,
1157166577,false,finalized,3,2/12/2017 18:15:58,Neut,0.6914,W97-0318,"Aspectual classification is a necessary component for a system that analyzes temporal constraints, or performs lexical choice and tense selection in machine translation (Moens and Steedman, 1988; Passonneau, 1988; Dorr, 1992; Klavans, 1994).",http://www.aclweb.org/anthology/W/W97/W97-0318.pdf,"(Moens and Steedman, 1988","Researchers have used empirical analysis of corpora to develop linguistically-based numerical indicators that aid in aspectual classification (Klavans and Chodorow, 1992; Siegel and McKeown, 1996).","Furthermore, stativity is the first of three fundamental temporal distinctions that compose the aspectual class of a clause.",
1157166578,false,finalized,3,2/12/2017 16:29:17,Neut,1.0,W97-0318,"and for the automatic identification of semantically related groups of words (Pereira, Tishby, and Lee, 1993; Hatzivassiloglou and McKeown, 1993).",http://www.aclweb.org/anthology/W/W97/W97-0318.pdf,"(Pereira, Tishby, and Lee, 1993","For more detail on the machine learning experiments described here, see Siegel (1997).",Table 4: Breakdown of verb occurrences.,
1157166579,false,finalized,3,2/12/2017 16:35:14,Neut,0.6987,W97-0318,"3Similar baselines for comparison have been used for many classification problems (Duda and Hart, 1973), e.g., part-of-speech tagging (Church, 1988; Allen, 1995).",http://www.aclweb.org/anthology/W/W97/W97-0318.pdf,"(Duda and Hart, 1973)",159,2This test was suggested by Judith Klavans (personal communication).,
1157166580,false,finalized,3,2/12/2017 16:38:27,Neut,0.6782,P11-2022,"A well-written document is coherent (Halliday and Hasan, 1976)- it structures information so that each new piece of information is interpretable given the preceding context.",http://www.aclweb.org/anthology/P/P11/P11-2022.pdf,"(Halliday and Hasan, 1976)","Models that distinguish coherent from incoherent documents are widely used in generation, summarization and text evaluation.",1 Introduction,
