_unit_id,_golden,_unit_state,_trusted_judgments,_last_judgment_at,what_is_the_function_of_this_citation,what_is_the_function_of_this_citation:confidence,article,current,link,marker,next,previous,what_is_the_function_of_this_citation_gold
1157166701,false,finalized,3,2/12/2017 18:36:12,Neut,1.0,W13-0804,"Chiang also introduced the cube pruning algorithm for hierarchical search (Chiang, 2007).",http://www.aclweb.org/anthology/W/W13/W13-0804.pdf,"(Chiang, 2007)",It is basically an adaptation of one of the k-best parsing algorithms by Huang and Chiang (2005).,Hierarchical phrase-based translation (HPBT) was first proposed by Chiang (2005).,
1157166702,false,finalized,3,2/12/2017 18:49:12,Neut,1.0,W13-0804,Good descriptions of the cube pruning implementation in the Joshua decoder have been provided by Li and Khudanpur (2008) and Li et al (2009b).,http://www.aclweb.org/anthology/W/W13/W13-0804.pdf,(2008),Xu and Koehn (2012) implemented hierarchical search with the cube growing algorithm in Moses and compared its performance to Moses' cube pruning implementation.,It is basically an adaptation of one of the k-best parsing algorithms by Huang and Chiang (2005).,
1157166703,false,finalized,3,2/12/2017 18:11:01,Pos,0.6777,W13-0804,"During decoding, a maximum length constraint of ten is applied to all non-terminals except the initial symbol S. Model weights are optimized with MERT (Och, 2003) on 100-best lists.",http://www.aclweb.org/anthology/W/W13/W13-0804.pdf,"(Och, 2003)",The optimized weights are obtained (separately for deep and for shallow-1 grammars) with a k-best generation size of 1000 for Chinese-*English and of 500 for Arabic-*English and kept for all setups.,"The language models are 4-grams with modified Kneser-Ney smoothing (Kneser and Ney, 1995; Chen and Goodman, 1998) which have been trained with the SRILM toolkit (Stolcke, 2002).",
1157166704,false,finalized,3,2/12/2017 19:07:58,Pos,0.6375,W00-1220,"The most important are Vendler(1967), Bache(1982), and Smith (1985) .",http://www.aclweb.org/anthology/W/W00/W00-1220.pdf,(1967),"They approximately classify the situation as four types: state, activity, accomplishment, and achievement.","In resent years, Western researchers have published a large volume of papers, which present many points of view.",
1157166705,false,finalized,3,2/12/2017 18:14:43,Neut,1.0,W00-1220,"Chen[3] points that some verbs belong to more than one category, and gives a method to distinguish these cases.",http://www.aclweb.org/anthology/W/W00/W00-1220.pdf,[3],"To make the ideal more clear, we use two steps to complete the sentence situation recognition.",(2) Separate classification of the verb situation from classification of the sentence situation.,
1157166706,false,finalized,3,2/12/2017 18:24:25,Pos,0.6512,W00-1220,"According to table 2.1, a classification algorithm was designed, and we use two resources to implement our algorithm: The Contemporary Chinese Cihai [11] (which we will refer to as the Cihai below) dictionary and the Machine Tractable Dictionary of Contemporary Chinese Predicate Verbs [12}(which we will refer to as the predicate dictionary below).",http://www.aclweb.org/anthology/W/W00/W00-1220.pdf,[11],"The Cihai dictionary includes 12,000 entries and 700,000 collocation instances, predicate dictionary includes about 3000 verbs with their semantic information, case relations and detailed collocation information.",2.3 Implementation of the algorithm,
1157166707,false,finalized,3,2/12/2017 18:26:33,Neut,1.0,S15-2120,Davidov et al (2010) examined hashtags that indicated sarcasm to identify if such labelled tweets can be a reliable source of sarcasm.,http://www.aclweb.org/anthology/S/S15/S15-2120.pdf,(2010),They concluded that user-labelled sarcastic tweets can be noisy and constitute the hardest form of sarcasm.,2010).,
1157166708,false,finalized,3,2/12/2017 18:08:39,Neut,0.6818,S15-2120,Riloff et al (2013) identify sarcasm that arises from the contrast between a positive sentiment referring to a negative situation.,http://www.aclweb.org/anthology/S/S15/S15-2120.pdf,(2013),"Reyes et al (2012) involved in their work features that make use of contextual imbalance, natural language concepts, syntactical and morphological aspects of a tweet.",They concluded that user-labelled sarcastic tweets can be noisy and constitute the hardest form of sarcasm.,
1157166709,false,finalized,3,2/12/2017 18:24:25,Neut,0.6711,N13-3003,"those MT outputs that are guaranteed to require less post-editing effort than the best corresponding TM match are presented to the post-editor (He et al., 2010a).",http://www.aclweb.org/anthology/N/N13/N13-3003.pdf,"(He et al., 2010a)","The MT is integrated seamlessly, and established localisation cost estimation models based on TM technologies still apply as upper bounds.",The confidence metric ensures that only Author did this work during his post doctoral research at CNGL.,
1157166710,false,finalized,3,2/12/2017 18:07:36,Neut,1.0,N13-3003,"(Specia, 2011) and (Specia et al., 2009, 2010) propose a confidence estimator that relates specifically to the post-editing effort of translators.",http://www.aclweb.org/anthology/N/N13/N13-3003.pdf,"(Specia, 2011)","This research uses regression on both the automatic scores assigned to the MT and scores assigned by posteditors and aims to model post-editors' judgements of the translation quality between good and bad, or among three levels of post-editing effort.","MT confidence estimation and its relation to existing TM scoring methods, together with how to make the most effective use of both technologies, is an active area of research.",
1157166711,false,finalized,3,2/12/2017 18:19:03,Pos,0.3467,N13-3003,"(Koehn and Haddow, 2009) presents a post-editing environment using information from the phrasebased SMT system Moses.2 (Guerberof, 2009) compares the post-editing effort required for TM and MT output, respectively.",http://www.aclweb.org/anthology/N/N13/N13-3003.pdf,"(Koehn and Haddow, 2009)","(Tatsumi, 2009) studies the correlation between automatic evaluation scores and post-editing effort.","Related research by (Simard and Isabelle., 2009) focuses on combining TM information into an SMT system for improving the performance of the MT when a close match already exists within the TM.",
1157166712,false,finalized,3,2/12/2017 18:11:08,Neut,1.0,N13-3003,"The SVM classifier outputs class labels and the class labels are converted into confidence scores using the techniques given in (Lin et al., 2007).",http://www.aclweb.org/anthology/N/N13/N13-3003.pdf,"(Lin et al., 2007)",Relying on system independent black-box features has allowed us to build,"System-independent features for each translation output are fed as input to the SVM classifier (Cortes and Vapnik, 1995).",
1157166713,false,finalized,3,2/12/2017 18:14:35,Neut,0.6872,D10-1091,"Because of the combinatorial nature of this problem, translation has to rely on heuristic search techniques such as greedy hill-climbing (Germann, 2003) or variants of best-first search like multi-stack decoding (Koehn, 2004).",http://www.aclweb.org/anthology/D/D10/D10-1091.pdf,"(Germann, 2003)","Moreover, to reduce the overall complexity of decoding, the search space is typically pruned using simple heuristics.",Translating a sentence amounts to finding the best scoring translation hypothesis in the search space.,
1157166714,false,finalized,3,2/12/2017 19:07:58,Pos,0.667,D10-1091,"To systematically assess the impact of the multiple heuristic decisions made during training and decoding, we propose, following (Dreyer et al., 2007; Auli et al., 2009), to work out oracle scores, that is to evaluate the best achievable performances of a PBTS.",http://www.aclweb.org/anthology/D/D10/D10-1091.pdf,"(Dreyer et al., 2007",We aim at both studying the expressive power of PBTS and at providing tools for identifying and quantifying causes of failure.,1.3 Contribution and organization,
1157166715,false,finalized,3,2/12/2017 18:07:36,Neut,1.0,D10-1091,"Koehn, 2007) or combining machine translation systems in a multi-source setting (Li and Khudanpur, 2009).",http://www.aclweb.org/anthology/D/D10/D10-1091.pdf,"Koehn, 2007)",We have also used oracle decoding to identify erroneous or difficult to translate references (Section 3.3).,934,
1157166716,false,finalized,3,2/12/2017 18:20:03,Neut,0.6585,D10-1091,"This measure is closely related to the BLEU-1 evaluation metric and the Meteor (Banerjee and Lavie, 2005) metric (when it is evaluated without considering near-matches and the distortion penalty).",http://www.aclweb.org/anthology/D/D10/D10-1091.pdf,"(Banerjee and Lavie, 2005)",We also believe that hypotheses that maximize the unigram precision and recall at the sentence level yield corpus level BLEU-4 scores close the maximal achievable.,"This amounts to evaluating translation quality in terms of unigram precision and recall, which are highly correlated with human judgements (Lavie et al., ).",
1157166717,false,finalized,3,2/12/2017 18:38:59,Neut,0.7009,D10-1091,"ILP has already been used in SMT to find the optimal translation for word-based (Germann et al., 2001) and to study the complexity of learning phrase alignments (De Nero and Klein, 2008) models.",http://www.aclweb.org/anthology/D/D10/D10-1091.pdf,"(Germann et al., 2001)","Following the latter reference, we introduce the following variables: fi,j (resp.","To solve the combinatorial problem introduced in the previous section, we propose to cast it into an Integer Linear Programming (ILP) problem, for which many generic solvers exist.",
1157166718,false,finalized,3,2/12/2017 18:15:54,Pos,0.7009,D10-1091,"Implementing the ""local"" or MJ-d (Kumar and Byrne, 2005) reordering strategy is also straightforward, and implies using the following constraints:",http://www.aclweb.org/anthology/D/D10/D10-1091.pdf,"(Kumar and Byrne, 2005)","Xai0,j0,k0,l0  k0k","l < m  1, ai,j,k,lai0,j0,l+1,l0  |i0  j  1 |< d",
1157166719,false,finalized,3,2/12/2017 18:08:39,Neut,0.6818,D10-1091,"Oracle decoding has also been used to assess the limitations induced by various reordering constraints in (Dreyer et al., 2007).",http://www.aclweb.org/anthology/D/D10/D10-1091.pdf,"(Dreyer et al., 2007)","To this end, the authors propose to use a beam-search based oracle decoder, which computes lower bounds of the best achievable BLEU-4 using dynamic programming techniques over finite-state (for so-called local and IBM constraints) or hierarchically structured (for ITG constraints) sets of hypotheses.","This is the main motivation of (Tillmann and Zhang, 2006), where the authors compute high BLEU hypotheses by running a conventional decoder so as to maximize a per-sentence approximation of BLEU-4, under a simple (local) reordering model.",
1157166720,false,finalized,3,2/12/2017 18:14:35,CoCo,0.6648,D10-1091,"The approach described in (Auli et al., 2009) is very similar to ours: in this study, the authors propose to find and analyze the limits of machine translation systems by studying the reference reachability.",http://www.aclweb.org/anthology/D/D10/D10-1091.pdf,"(Auli et al., 2009)",A reference is reachable for a given system if it can be exactly generated by this system.,"To the best of our knowledge, there are only a few works that try to study the expressive power of phrase-based machine translation systems or to provide tools for analyzing potential causes of failure.",
1157166721,false,finalized,3,2/12/2017 18:18:11,Pos,1.0,D10-1091,"In our experiments, we used the free solver SCIP (Achterberg, 2007).",http://www.aclweb.org/anthology/D/D10/D10-1091.pdf,"(Achterberg, 2007)",An optimal solution was found for all problems we considered.,"Even though ILP problems are NP-hard in general, there exist several off-theshelf ILP solvers able to efficiently find an optimal solution or decide that the problem is infeasible.",
1157166722,false,finalized,3,2/12/2017 18:19:49,Pos,0.6544,D13-1151,"In his comprehensive review of outlier detection methods in textual data, Guthrie (2008) compares a variety of vectorization methods along with a variety of generic outlier methods.",http://www.aclweb.org/anthology/D/D13/D13-1151.pdf,(2008),"The vectorization methods employ a variety of lexical and syntactic stylistic features, while the outlier detection methods use a variety of similarity/distance measures such as cosine and Euclidean distance.","Subsequent work, such as the StahelDonoho Estimator (Stahel, 1981; Donoho, 1982), PCout (Filzmoser et al., 2008), LOF (Breunig and Kriegel, 2000) and ABOD (Kriegel et al., 2008) have generalized univariate methods to highdimensional data points.",
1157166723,false,finalized,3,2/12/2017 18:38:59,Neut,0.7009,D13-1151,"Similar methods have also been used in the field of intrinsic plagiarism detection, which involves segmenting a text and then identifying outlier segments (Stamatatos, 2009; Stein et al., 2010).",http://www.aclweb.org/anthology/D/D13/D13-1151.pdf,"(Stamatatos, 2009",3 Proximity Methods,"The vectorization methods employ a variety of lexical and syntactic stylistic features, while the outlier detection methods use a variety of similarity/distance measures such as cosine and Euclidean distance.",
1157166724,false,finalized,3,2/12/2017 18:08:39,Pos,1.0,N07-1039,"We used an implementation of Brill's (1992) part-of-speech tagger to find adjectives and modifiers; for parsing, we used the Stanford dependency parser (Klein and Manning, 2003).",http://www.aclweb.org/anthology/N/N07/N07-1039.pdf,(1992),6 Evaluating Extraction,"Each document in each corpus was preprocessed into individual sentences, lower-cased, and tokenized.",
1157166725,false,finalized,3,2/12/2017 18:07:44,Neut,0.6774,N07-1039,"In this regard, we will be examining extension of existing methods for automatically building lexicons of positive/negative words (Turney, 2002; Esuli and Sebastiani, 2005) to the more complex task of estimating also attitude type and force.",http://www.aclweb.org/anthology/N/N07/N07-1039.pdf,"(Turney, 2002",,"sions, such as where an attitude is expressed via a noun or a verb.",
1157166726,false,finalized,3,2/12/2017 18:19:03,CoCo,1.0,N07-1039,The idea is similar to Agrawal and Srikant's (1995) notion of generalized association rules.,http://www.aclweb.org/anthology/N/N07/N07-1039.pdf,(1995),"We treat each appraisal expression as a transaction, with the attributes of attitude type, orientation, polarity, force, and thing type, as well as the document attributes product name, product type, and document classification (based on the number of stars the reviewer gave the product).","We generally look for rules that contain attitude type, orientation, thing type, and a product name, when these rules occur more frequently than expected.",
1157166727,false,finalized,3,2/12/2017 18:15:53,Pos,0.697,N07-1039,"For adjectival attitudes, we used the lexicon developed we developed in our previous work (Whitelaw et al., 2005) on appraisal.",http://www.aclweb.org/anthology/N/N07/N07-1039.pdf,"(Whitelaw et al., 2005)",We reviewed the entire lexicon to determine its accuracy and made numerous improvements.,311,
1157166728,false,finalized,3,2/12/2017 18:14:35,Pos,0.6648,N07-1039,"We use CLOSET+ (Wang et al., 2003) to find all of the frequent closed itemsets in the data, with a support greater than or equal to 20 occurrences.",http://www.aclweb.org/anthology/N/N07/N07-1039.pdf,"(Wang et al., 2003)","Let (b, a1, a2,... an) or (b, A) denote the contents of an itemset, and c ((b, A)) denote the support for this itemset.","We treat each appraisal expression as a transaction, with the attributes of attitude type, orientation, polarity, force, and thing type, as well as the document attributes product name, product type, and document classification (based on the number of stars the reviewer gave the product).",
1157166729,false,finalized,3,2/12/2017 18:15:53,Neut,0.6818,W12-2202,"Earlier work already establishes the importance of lexical changes for text simplification (Carroll et al., 1998; Caseli et al., 2009; De Belder et al., 2010).",http://www.aclweb.org/anthology/W/W12/W12-2202.pdf,"(Carroll et al., 1998","Upon examining a parallel corpus consisting of original and manually simplified newspaper articles in Spanish, we have found that by far the most common type of changes applied by human editors are precisely lexical changes, accounting for 17.48% of all annotated operations (Bott and Saggion, 2012a).","The present work, however, deals with lexical simplification and is centred around a corpus analysis, a preparatory stage for the development of a separate lexical module in the future.",
1157166730,false,finalized,3,2/12/2017 18:20:03,Neut,0.6494,W12-2202,"Upon examining a parallel corpus consisting of original and manually simplified newspaper articles in Spanish, we have found that by far the most common type of changes applied by human editors are precisely lexical changes, accounting for 17.48% of all annotated operations (Bott and Saggion, 2012a).",http://www.aclweb.org/anthology/W/W12/W12-2202.pdf,"(Bott and Saggion, 2012a)",Words perceived as more complicated are replaced,"Earlier work already establishes the importance of lexical changes for text simplification (Carroll et al., 1998; Caseli et al., 2009; De Belder et al., 2010).",
1157166731,false,finalized,3,2/12/2017 18:19:49,Neut,0.6774,W12-2202,"The PSET project (Carroll et al., 1998) dealt with simplification of news articles in English for aphasic readers.",http://www.aclweb.org/anthology/W/W12/W12-2202.pdf,"(Carroll et al., 1998)","Together with syntactic analysis and transformations similar to those of Chandrasekar et al (1996), they employed lexical simplification based on looking up synonyms in WordNet and extracting Kucera-Francis frequency from the Oxford Psycholinguistic Database (Quinlan, 1992).","The earliest simplification systems employed a rule-based approach and focused on syntactic structure of the text (Chandrasekar et al., 1996).",
1157166732,false,finalized,3,2/12/2017 18:49:12,Neut,0.3683,W12-2202,"Bautista et al (2009) also rely on a dictionary of synonyms, but their criterion for choosing the most appropriate one is wordlength rather than frequency.",http://www.aclweb.org/anthology/W/W12/W12-2202.pdf,(2009),"Caseli et al (2009) analyse lexical operations on a parallel corpus of original and manually simplified texts in Portuguese, using lists of simple words and discourse markers as resources.","The above approach to lexical simplification has been repeated in a number of works (Lal and Ruger, 2002; Burstein et al., 2007).",
1157166733,false,finalized,3,2/12/2017 18:11:08,Neut,0.6262,W12-2202,"The automatic alignments have then been manually corrected through a graphical editing tool within the GATE framework (Cunningham et al., 2002).",http://www.aclweb.org/anthology/W/W12/W12-2202.pdf,"(Cunningham et al., 2002)","A total of 570 sentences have been aligned (246 in original and 324 in simple texts), with the following correlations between them: one to one, one to many or many to one, as well as cases where there is no correlation (cases of content reduction through summarisation or information expansion through the introduction of definitions).","aligning algorithm based on Hidden Markov Models (Bott and Saggion, 2011) has been applied to obtain sentence-level alignments.",
1157166735,false,finalized,3,2/12/2017 18:35:28,CoCo,0.6749,W12-2202,"Together with syntactic analysis and transformations similar to those of Chandrasekar et al (1996), they employed lexical simplification based on looking up synonyms in WordNet and extracting Kucera-Francis frequency from the Oxford Psycholinguistic Database (Quinlan, 1992).",http://www.aclweb.org/anthology/W/W12/W12-2202.pdf,(1996),"Therefore, the most frequent of a set of synonyms for every content word of the input text was chosen to appear in its simplified version.","The PSET project (Carroll et al., 1998) dealt with simplification of news articles in English for aphasic readers.",
1157166736,false,finalized,3,2/12/2017 19:07:58,Neut,1.0,W06-2938,"The treebanks (Hajic et al., 2004; Chen et al., 2003; Bohmova et al., 2003; Kromann, 2003; van der Beek et al., 2002; Brants et al., 2002; Kawata and Bartels, 2000; Afonso et al., 2002; Dzeroski et al., 2006; Civit Torruella and MartiAntonin, 2002; Nilsson et al., 2005; Oflazer et al., 2003; Atalay et al., 2003) provided for the CoNLL shared task(Buchholz et al., 2006) were converted to a set of instances each of which consists of the attributes of a candidate word pair with a classification that indicates the existence, direction and type of the dependency link between the pair.",http://www.aclweb.org/anthology/W/W06/W06-2938.pdf,"(Hajic et al., 2004",An initial model is built to identify dependency relations between adjacent word pairs using a decision list learning algorithm.,This paper presents an approach to supervised learning of dependency relations in a language using standard machine learning techniques.,
1157166737,false,finalized,3,2/12/2017 18:28:49,Pos,1.0,P00-1059,"For a more detailed discussion of the issue of metrics in evaluation, of the metrics we have used, and of an experiment relating human judgments to these metrics, see (Bangalore et al., 2000).",http://www.aclweb.org/anthology/P/P00/P00-1059.pdf,"(Bangalore et al., 2000)",String accuracy measures the performance of the entire FERGUS system.,"This number is subtracted from and then divided by the length of the sentence, yielding a number between 0 and 1, with 1 the best score.",
1157166738,false,finalized,3,2/13/2017 05:07:17,Neut,0.6292,W00-1004,"A quote from the most recent Switchboard labeling standard (Hamaker et al., 1998) gives the flavor: 20.",http://www.aclweb.org/anthology/W/W00/W00-1004.pdf,"(Hamaker et al., 1998)","Hesitation Sounds: Use ""uh"" or ""oh"" for hesitations consisting of a vowel sound, and ""urn"" or ""hm"" for hesitations with a nasal sound, depending upon which transcription the actual sound is closest to.",An alternative approach is seen in some schemes used for labeling corpora for purposes of training and evaluating speech recognizers.,
1157166739,false,finalized,3,2/13/2017 04:57:38,Neut,1.0,W00-1004,"21: yes/no sounds: Use ""uh-huh"" or ""um-hum"" (yes) and ""huh-uh"" or ""hum-um"" (no) for anything remotely resembling these sounds of assent or denial"" Another scheme (Lander, 1996) lists several ""miscellaneous words"", including:",http://www.aclweb.org/anthology/W/W00/W00-1004.pdf,"(Lander, 1996)",30,"<other speaker responds> urn ok, I see your point.""",
1157166740,false,finalized,3,2/13/2017 05:05:39,Neut,0.6891,W00-1004,"While it is not possible to devise a single transcription scheme which is perfect for all purposes (Barry and Fourcin, 1992), it is clear that the current schemes all have room for improvement.",http://www.aclweb.org/anthology/W/W00/W00-1004.pdf,"(Barry and Fourcin, 1992)",3 Proposal,"2. can represent all observed grunts, and 3. unambiguously represents all meaningful differences in sound.",
1157166741,false,finalized,3,2/13/2017 05:07:04,Neut,0.6766,D13-1021,"Htun et al (2012) extended the many-to-many alignment for the sample-wise transliteration mining, but its noise model only handles the sample-wise noise and cannot distinguish partial noise.",http://www.aclweb.org/anthology/D/D13/D13-1021.pdf,(2012),We model partial noise in the CRP-based joint substring model.,We introduce a noise symbol to handle partial noise in the many-to-many alignment model.,
1157166742,false,finalized,3,2/13/2017 04:51:52,Neut,1.0,D13-1021,"phrases in statistical machine transliteration and improved transliteration performance (Finch and Sumita, 2010).",http://www.aclweb.org/anthology/D/D13/D13-1021.pdf,"(Finch and Sumita, 2010)","We extracted them by: 1) generate many-to-many word alignment, in which all possible word alignment links in many-to-many correspondences (e.g., 0-0 0-1 0-2 1-0 1-1 1-2 for  , c o m), 2) run phrase extraction and scoring same as a standard Moses training.","BASELINE 104,563 899,080 1,372,993 PROPOSED 104,561 893,366 1,317,256",
1157166743,false,finalized,3,2/13/2017 05:00:13,Neut,1.0,P06-2061,"A desired feature of computer-assisted translation (CAT) systems is the integration of the human speech into the system, as skilled human translators are faster at dictating than typing the translations (Brown et al., 1994).",http://www.aclweb.org/anthology/P/P06/P06-2061.pdf,"(Brown et al., 1994)","Additionally, incorporation of a statistical prediction engine, i.e.",1 Introduction,
1157166744,false,finalized,3,2/13/2017 04:54:08,Neut,1.0,P06-2061,"A statistical prediction engine provides the completions to what a human translator types (Foster et al., 1997; Och et al., 2003).",http://www.aclweb.org/anthology/P/P06/P06-2061.pdf,"(Foster et al., 1997","Then, one possible procedure for skilled human translators is to provide the oral translation of a given source text and then to post-edit the recognized text.","a statistical interactive machine translation system, to the CAT system is another useful feature.",
1157166745,false,finalized,3,2/13/2017 05:09:33,Neut,0.676,P06-2061,"In the post-editing step, a prediction engine helps to decrease the amount of human interaction (Och et al., 2003).",http://www.aclweb.org/anthology/P/P06/P06-2061.pdf,"(Och et al., 2003)","In a CAT system with integrated speech, two sources of information are available to recognize the speech input: the target language speech and the given source language text.","Then, one possible procedure for skilled human translators is to provide the oral translation of a given source text and then to post-edit the recognized text.",
