_unit_id,_golden,_unit_state,_trusted_judgments,_last_judgment_at,what_is_the_function_of_this_citation,what_is_the_function_of_this_citation:confidence,article,current,link,marker,next,previous,what_is_the_function_of_this_citation_gold
1157166623,false,finalized,3,2/12/2017 16:25:57,Neut,0.7123,Q14-1008,A closer look at the knowledge acquired by our models shows that the Unique Stress Constraint of Yang (2004) can be acquired jointly with segmenting the input instead,http://www.aclweb.org/anthology/Q/Q14/Q14-1008.pdf,(2004),93,"Relatedly and in line with the finding that stress cues are used by infants before phonotactic cues (Jusczyk et al., 1999a), we observe that phonotactic cues require more input than stress cues to be used efficiently.",
1157166624,false,finalized,3,2/12/2017 16:38:13,Pos,0.6956,Q14-1008,"Following Cutler and Carter (1987)'s observation that stressed syllables tend to occur at the beginnings of words in English, Jusczyk et al (1993) investigated whether infants acquiring English take advantage of this fact.",http://www.aclweb.org/anthology/Q/Q14/Q14-1008.pdf,(1987),"Their study demonstrated that this is indeed the case for 9 month olds, although they found no indication of using stressed syllables as cues for word boundaries in 6 month olds.","Lexical stress is the ""accentuation of syllables within words"" (Cutler, 2005) and has long been argued to play an important role in adult word recognition.",
1157166625,false,finalized,6,2/12/2017 16:27:17,Neut,0.5116,Q14-1008,Yang (2004) introduced a simple incremental algorithm that relies on stress by embodying a Unique Stress Constraint (USC) that allows at most a single stressed syllable per word.,http://www.aclweb.org/anthology/Q/Q14/Q14-1008.pdf,(2004),"On pre-syllabified child directed speech, he reported a word token fscore of 85.6% for a non-statistical algorithm that exploits the USC.","They only reported a word-token f-score of 44% (roughly, segmentation accuracy: see Section 4), which is considerably below the performance of subsequent models, making a direct comparison complicated.",
1157166626,false,finalized,3,2/12/2017 16:41:43,Neut,0.6556,Q14-1008,"More recently, Lignos (2010, 2011, 2012) further explored Yang's original algorithm, taking into account that function words should not be assumed to possess lexical stress cues.",http://www.aclweb.org/anthology/Q/Q14/Q14-1008.pdf,"(2010, 2011, 2012)","While his scores are in line with those reported by Yang, the importance of stress for this learner were more modest, providing a gain of around 2.5% (Lignos, 2011).","While the USC has been argued to be near-to-universal and follows from the ""culminative function of stress"" (Fromkin, 2001; Cutler, 2005), the high score Yang reported crucially depends on every word token carrying stress, including function words.",
1157166627,false,finalized,3,2/12/2017 16:33:33,Weak,1.0,Q14-1008,"However, Doyle and Levy (2013) do not directly examine the probabilities assigned to the stress-templates; they only report that their model does slightly prefer stress-initial words over the baseline model by calculating the fraction of stress-initial word types in the output segmentations of their models.",http://www.aclweb.org/anthology/Q/Q14/Q14-1008.pdf,(2013),"They also demonstrate that stress cues do indeed aid segmentation, although their reported gain of 1% in token f-score is even smaller than that reported by Lignos (2011).",This allows the model to acquire knowledge about the stress patterns of its input by assigning different probabilities to the different stress-templates.,
1157166628,false,finalized,3,2/12/2017 16:38:13,Pos,0.3531,Q14-1008,"The models we examine are derived from the collocational model of Johnson and Goldwater (2009) by varying three parameters, resulting in 6 models: two baselines that do not take advantage of stress cues and either do or do not use phonotactics, as described in Section 3.2; and four stress models that differ with respect to the use of phonotactics, and as to whether they embody the Unique Stress Constraint introduced by Yang (2004).",http://www.aclweb.org/anthology/Q/Q14/Q14-1008.pdf,(2009),We describe these models in section 3.3.,"We give an intuitive description of the mathematical background of Adaptor Grammars in 3.1, referring the reader to Johnson et al (2007) for technical details.",
1157166629,false,finalized,3,2/12/2017 16:37:33,Neut,0.6707,Q14-1008,"Intuitively, the reason stress helps infants in segmenting English is that a stressed syllable is a reliable indicator of the beginning of a word (Jusczyk et al., 1993).",http://www.aclweb.org/anthology/Q/Q14/Q14-1008.pdf,"(Jusczyk et al., 1993)","More generally, if there is a (reasonably) reliable relationship between the position of stressed syllables and beginnings (or","In order for stress cues to be helpful, the model must have some way of associating the position of stress with word-boundaries.",
1157166630,false,finalized,3,2/12/2017 16:41:50,CoCo,0.3505,Q14-1008,"3This is, in essence, also the strategy chosen by Doyle and Levy (2013).",http://www.aclweb.org/anthology/Q/Q14/Q14-1008.pdf,(2013),96,This (partly) captures the tendency of English for stress-initial words and thus provide an additional cue for identifying words; and it is exactly the kind of preference infant learners of English seem to acquire (Jusczyk,
1157166631,false,finalized,3,2/12/2017 16:34:53,Neut,0.6469,Q14-1008,"We can also add the Unique Stress Constraint (USC) (Yang, 2004) by excluding all variants of rule (18) that generate two or more stressed syllables.",http://www.aclweb.org/anthology/Q/Q14/Q14-1008.pdf,"(Yang, 2004)","For example, while the lexical generator for the colloc3-nophon-stress model will include the rule Word  SSyll SSyll, the lexical generator embodying the USC lacks this rule.",This yields the colloc3-phon-stress model.,
1157166632,false,finalized,3,2/12/2017 17:00:34,Pos,1.0,Q14-1008,"We also added stress information to the BrentBernstein-Ratner corpus (Bernstein-Ratner, 1987; Brent, 1999), following the procedure just outlined.",http://www.aclweb.org/anthology/Q/Q14/Q14-1008.pdf,"(Bernstein-Ratner, 1987",This corpus is a de-facto standard for evaluat,"As function words account for roughly 50% of the tokens but only roughly 5% of the types in our corpora, this means that the type and token distribution of stress patterns differs dramatically in all our corpora, as can be seen from Table 2.",
1157166633,false,finalized,4,2/12/2017 16:29:28,Neut,1.0,Q14-1008,"Relatedly, recent work such as Borschinger et al (2013) has found that artificially created data often masks the complexity exhibited by real speech.",http://www.aclweb.org/anthology/Q/Q14/Q14-1008.pdf,(2013),"This suggests that future work should use data directly derived from the acoustic signal to account for contextual effects, rather than using dictionary look-up or other heuristics.","For example, languages such as French lack lexical stress; it would be interesting to know whether in such a case, phonotactic (or other) cues are more important.",
1157166634,false,finalized,3,2/12/2017 17:52:36,Pos,1.0,Q14-1008,"Following Christiansen et al (1998) and Doyle and Levy (2013), we use the Korman corpus (Korman, 1984) as one of our corpora.",http://www.aclweb.org/anthology/Q/Q14/Q14-1008.pdf,(1998),"It comprises childdirected speech for very young infants, aged between 6 and 16 weeks and, like all other corpora used in this paper, is available through the CHILDES database (MacWhinney, 2000).",4.1 Corpora and corpus creation,
1157166635,false,finalized,6,2/12/2017 16:27:17,Pos,0.6769,Q14-1008,"As our third corpus, we use the Alex portion of the Providence corpus (Demuth et al., 2006; Borschinger et al., 2012).",http://www.aclweb.org/anthology/Q/Q14/Q14-1008.pdf,"(Demuth et al., 2006",A major benefit of the Providence corpus is that the video-recordings from which the transcripts were produced are available through CHILDES alongside the transcripts.,"ing models of Bayesian word segmentation (Brent, 1999; Goldwater, 2007; Goldwater et al., 2009; Johnson and Goldwater, 2009), comprising in total 9790 utterances.",
1157166636,false,finalized,3,2/12/2017 16:41:48,CoCo,0.3614,Q14-1008,This results 2We follow Johnson and Goldwater (2009) in limiting the length of possible words to four syllables to speed up runtime.,http://www.aclweb.org/anthology/Q/Q14/Q14-1008.pdf,(2009),"In pilot experiments, this choice did not have a noticeable effect on segmentation performance.","Alternatively, one could limit the models ability to capture word-to-word dependencies by removing rules (1) to (3).",
1157166637,false,finalized,3,2/12/2017 18:08:39,Pos,0.3788,Q14-1008,"Unlike Christiansen et al (1998), Yang (2004), and Doyle and Levy (2013), we follow Lignos and Yang (2010) in making the more realistic assumption that the 94 mono-syllabic function words listed by Selkirk (1984) never surface with lexical stress.",http://www.aclweb.org/anthology/Q/Q14/Q14-1008.pdf,(1998),"As function words account for roughly 50% of the tokens but only roughly 5% of the types in our corpora, this means that the type and token distribution of stress patterns differs dramatically in all our corpora, as can be seen from Table 2.","Our version of the Korman corpus contains, in total, 11413 utterances.",
1157166638,false,finalized,3,2/12/2017 18:19:46,Neut,0.6906,J11-2002,"(For standard, in-depth, introductions to this fascinating field, see, e.g., Nida [1949], Jensen [1990], Spencer and Zwicky [1998], or Haspelmath [2002].)",http://www.aclweb.org/anthology/J/J11/J11-2002.pdf,[1949],"In language technology applications, a morphological component forms a bridge between texts and structured information about the vocabulary of a language.","If a language has suffixing and/or prefixing-sometimes called concatenative morphology-it obviously follows that text words in that language can be segmented into a sequence of morphological elements: a stem and a number of suffixes after the stem and/or prefixes before the stem.1 Morphology is one of the oldest linguistic subdisciplines, and this brief presentation by necessity omits many intricacies and greatly simplifies a vast scholarship.",
1157166639,false,finalized,3,2/12/2017 18:19:49,Neut,0.6774,J11-2002,"In Andreev (1965b) the method is tested extensively on Russian, which is the subject of several papers in the volume, and a number of other languages: Albanian (Persikov 1965), Armenian (Melkumjan 1965), Bulgarian (Fedulova 1965), Czech (Ozigova 1965), English (Malahovskij 1965), Estonian (Hol'm 1965), French (Kordi 1965), German (Fitialova 1965), Hausa (Fihman 1965a), Hungarian (Andreev 1965a), Latvian (Jakubajtis 1965), Serbo-Croatian (Panina 1965), Swahili (Fihman 1965b), Ukrainian (Eliseeva 1965), and Vietnamese (Jakuseva 1965).",http://www.aclweb.org/anthology/J/J11/J11-2002.pdf,(1965b),"As an aside, we may note that only after the turn of the millennium are we again seeing this variety of languages in ULM work.","The initial suffix candidate, -oj, has a high functional load and consequently a high text frequency: It is the most ambiguous of the Russian adjective suffixes, appearing in four different slots in the adjective paradigm, and is also homonymous with a noun suffix.",
1157166640,false,finalized,3,2/12/2017 18:26:36,Error,0.6873,J11-2002,"2005b; Xanthos, Hu, and Goldsmith 2006 Baroni 2000, 2003 C T Child-English/ Affix List English Cho and Han 2002 C T Korean Segmentation Sharma, Kalita, and Das 2002, 2003; C T Assamese Lexicon+ Paradigms Sharma and Das 2002 Baroni, Matiasek, and Trost 2002 C/NC T English/German (I) Related word pairs Bati 2002 C/NC T Amharic Lexicon+ Paradigms Creutz 2003, 2006; Creutz and C T Finnish/Turkish/ Segmentation Lagus 2002, 2004, 2005a, 2005b, English 2005c, 2007; Creutz, Lagus, and Virpioja 2005; Hirsimaki et al.",http://www.aclweb.org/anthology/J/J11/J11-2002.pdf,"a, 2005b, ",2003; Creutz et al.,"Harris 1955, 1968, 1970 C T English Segmentation Andreev 1965a, Andreev 1967, C T Vietnamese to Segmentation Chapter 2, Persikov 1965; Hungarian (I) Melkumjan 1965; Fedulova 1965; Ozigova 1965; Malahovskij 1965; Hol'm 1965; Kordi 1965; Fitialova 1965; Fihman 1965a; Andreev 1965a; Jakubajtis 1965; Panina 1965; Fihman 1965b; Eliseeva 1965; Jakuseva 1965 Gammon 1969 C T English Segmentation Lehmann 1973, pages 71-93 C T French (I) Segmentation de Kock and Bossaert 1969, 1974, C T French/Spanish Lexicon+ Paradigms 1978 Faulk and Gustavson 1990 C T English (I) Segmentation Hafer and Weiss 1974 C T English (IR) Segmentation Klenk and Langer 1989 C T+SP German Segmentation Langer 1991 C T+SP German Segmentation Redlich 1993 C T English (I) Segmentation Klenk 1992, 1991 C T+SP Spanish Segmentation Flenner 1992, 1994, 1995 C T+SP Spanish Segmentation Janen 1992 C T+SP French Segmentation Juola, Hall, and Boggs 1994 C T English Segmentation Brent 1993, 1999; Brent, Murthy, C T English/Child- Segmentation and Lundberg 1995; Snover 2002; English/Polish/ Snover, Jarosz, and Brent 2002; French Snover and Brent 2001, 2003 Deligne and Bimbot 1997; Deligne C T English/French (I) Segmentation 1996 Yvon 1996 C T French (I) Segmentation Kazakov 1997; Kazakov and C T French/English Segmentation Manandhar 1998, 2001 Jacquemin 1997 C T English Segmentation Cromm 1997 C T German Segmentation Gaussier 1999 C T French/English (I) Lexicon+ Paradigms Dejean 1998a, 1998b C T Turkish/English/ Affix Lists Korean/French/ Swahili/ Vietnamese (I) Medina Urrea 2000, 2003, 2006b C T Spanish Affix List Schone and Jurafsky 2000, 2001a; C T English Segmentation Schone 2001 Goldsmith 2000, 2001, 2006; Belkin C T English (I) Lexicon+ Paradigms and Goldsmith 2002; Goldsmith, Higgins, and Soglasnova 2001; Hu et al.",
1157166641,false,finalized,3,2/12/2017 18:21:01,Neut,0.6262,J11-2002,"2005a C/NC T Unclear Unclear Bacchin, Ferro, and Melucci 2005, C T Italian/English Segmentation 2002a, 2002b; Nunzio et al.",http://www.aclweb.org/anthology/J/J11/J11-2002.pdf,"a, 2002b","2004 Oliver 2004, Chapter 4-5 C T Catalan Paradigms Bordag 2005a, 2005b, 2007, 2008 C T English/German Segmentation Hammarstrom 2005, 2006a, 2006b, C - Maori to Warlpiri Same-stem 2007b, 2009a, 2009b Bernhard 2005a, 2005b, 2006, 2007, C T Finnish/Turkish/English Segmentation+ 2008 Related sets of words Keshava and Pitler 2005 C T Finnish/Turkish/English Segmentation Johnsen 2005 C T Finnish/Turkish/English Segmentation Atwell and Roberts 2005 C T Finnish/Turkish/English Segmentation Dang and Choudri 2005 C T Finnish/Turkish/English Segmentation ur Rehman and Hussain 2005 C T Finnish/Turkish/English Segmentation Jordan, Healy, and Keselj 2005, 2006 C T Finnish/Turkish/English Segmentation Goldwater, Griffiths, and Johnson C T English/Child-English Segmentation 2005; Goldwater 2007; Naradowsky and Goldwater 2009 Freitag 2005 C T English Segmentation Golcher 2006 C - English/German Lexicon+ Paradigms Arabsorkhi and Shamsfard 2006 C T Persian Segmentation Chan 2006, Chan 2008, C T English Paradigms pages 101-139 Demberg 2007 C/NC T English/German/ Segmentation Finnish/Turkish Dasgupta and Ng 2006, 2007a; C T Bengali Segmentation 2007b; Dasgupta 2007 De Pauw and Wagacha 2007 C/NC T Gikuyu Segmentation Tepper 2007; Tepper and Xia 2008 C/NC T+RR English/Turkish Analysis Xanthos 2007 NC T Arabic Lexicon+ Paradigms Majumder et al.",2005; Hu et al.,
1157166642,false,finalized,3,2/12/2017 18:24:25,Neut,1.0,J11-2002,See Goldsmith and Xanthos (2009) for an excellent survey on how to do this (something which falls under learning phonological categories rather than morphology learning).,http://www.aclweb.org/anthology/J/J11/J11-2002.pdf,(2009),"Basically, it is possible only because there are systematic combination constraints between different phonemes (approximated by graphemes); for example, vowels and consonants alternate in a very non-random manner.","Xanthos (2007), on the other hand, starts out only by assuming that there exists a distinction between root and pattern graphemes and subsequently learns which graphemes are which.",
1157166643,false,finalized,3,2/12/2017 18:07:36,CoCo,0.3683,J11-2002,"In the group-and-abstract paradigm, working with feature sets of a word, as in De Pauw and Wagacha (2007), is an ingenious generalization that holds numerous advantages over string edit distances.",http://www.aclweb.org/anthology/J/J11/J11-2002.pdf,(2007),"Feature set comparisons are naturally defined over arbitrary collections, whereas string edit distances work on pairs of strings.",The recent increased interest in Bayesian generative models in general in NLP may possibly serve as a catalyst.,
1157166644,false,finalized,3,2/12/2017 18:07:36,Neut,1.0,P00-1072,"One can prove that Ak is the best approximation to A for any unitray invariant norm(Michael W. Berry and Jessup, 1999) three variant probability estimation methods in dimension-reduced space.",http://www.aclweb.org/anthology/P/P00/P00-1072.pdf,"Berry and Jessup, 1999)",First is estimating p(y Ix) by computing distance between given word x and predicting word y in reduced space.,"Now, we suggest 21n other words, the projection into the reduced space is chosen such that the representations in the original space are changed as little as possible when measured by the sum of the squares of the differences.",
1157166645,false,finalized,3,2/12/2017 18:35:28,Neut,0.3715,P00-1072,"The similarity-based method(Dagan et al., 1999) and dimension reduction technique can be merged into one model 3 .",http://www.aclweb.org/anthology/P/P00/P00-1072.pdf,"(Dagan et al., 1999)",Reduced dimension can be better representation space than the original space for finding similarities between words.,(k = 3) (dim = 2) (6 = 0.1) (0 = 0) P(swig I coffee) 0 0.09 0 0.1627 0.0756 0.11 P(sip I coffee) 1 1 1 0.2425 0.5536 1 P(drink I coffee) 0 0.18 0.17 0.2359 0.1932 0.28 P(devour I coffee) 0 0.18 0.11 0.1271 0.0726 0.11 P(eat I coffee) 0 0.18 0.11 0.1159 0.0526 0 P(swallow I coffee) 0 0.18 0.11 0.1159 0.0526 0 2.3.3 Method 3: Dimension-reduced similarity-based method,
1157166646,false,finalized,3,2/12/2017 18:19:51,CoCo,0.7009,P00-1072,"Data preparation method and error counting scheme are almost similar to that of similarity-based methods (Dagan et al., 1999) (Lee and Pereira, 1999).",http://www.aclweb.org/anthology/P/P00/P00-1072.pdf,"(Dagan et al., 1999)","Performance is measured by the error rate, defined as error rate = T-1(0 of incorrect choices) where T is the size of test set.","Each method is presented with a noun and two verbs, deciding which verb is more likely to have the noun as a direct object.",
1157166647,false,finalized,3,2/12/2017 18:11:01,Pos,0.6906,P00-1072,"For similarity-based method, the parameter tuning is important to improve performance but we use the simplified unweighted average equation as in (Lee and Pereira, 1999) 6 .",http://www.aclweb.org/anthology/P/P00/P00-1072.pdf,"(Lee and Pereira, 1999)","Since this equation is the same as our estimation method in Section 2.3.3, we can say that the comparison is fair.","Pd(Yilxi) frq(xi, yi) > 0 cx(xi) P(yi) frq(xi,yi) = 0",
1157166648,false,finalized,3,2/12/2017 18:11:08,Neut,1.0,W11-2820,"In particular, adaptive hypertext (O'Donnell et al., 2001) adapts the content and form of natural language text.",http://www.aclweb.org/anthology/W/W11/W11-2820.pdf,"Donnell et al., 2001)",Systems like this introduce the need for a good model of the context and how it influences language.,Adaptive interfaces change the style and content of interaction according to the context of use.,
1157166649,false,finalized,3,2/12/2017 18:36:12,Neut,0.6422,W11-2820,"In the VRE, the link between the social network and digital artifacts is established formally, by the integration of the FOAF social networking vocabulary (Brickley and Miller, 2010) with our provenance ontologies.",http://www.aclweb.org/anthology/W/W11/W11-2820.pdf,"(Brickley and Miller, 2010)","FOAF characterises an individual and their social network by defining a vocabulary describing people, the links between them and the things they create and do.",The user's social context.,
1157166650,false,finalized,3,2/12/2017 18:14:20,Pos,1.0,W11-2820,"This service generates text containing a description of the resource using a deep model of the syntactic structure of sentences and their combinations, inspired by the work of Hielkema (2010).",http://www.aclweb.org/anthology/W/W11/W11-2820.pdf,(2010),VRE User Interface User Core Services Social Networking Metadata Repository Policy Policy Manager Text Interface,"In order to generate the text, we have implemented a RESTful service that invokes a Text Generator service based on the RDF ID of the resource being described, passed as a parameter by the Web interface.",
1157166651,false,finalized,3,2/12/2017 18:28:49,Neut,0.3488,W11-2820,"To determine if two policies may conflict, we plan to use a conflict detection mechanism similar to the one proposed by Sensoy et al (2010).",http://www.aclweb.org/anthology/W/W11/W11-2820.pdf,(2010),"Moreover regarding usability, we need to implement a system that would allow users to easily create SPIN rules representing their policies, possibly using a NLG interface.","Using such a strategy, the Policy Manager would be able to determine how to prioritise conflicting policies applying to a particular resource.",
1157166652,false,finalized,3,2/12/2017 18:15:53,Pos,0.7009,W11-2143,"We managed our experiments with LoonyBin (Clark and Lavie, 2010), an open-source tool for defining, modifying, and running complex experimental pipelines.",http://www.aclweb.org/anthology/W/W11/W11-2143.pdf,"(Clark and Lavie, 2010)",We describe our system-building process in more detail in Section 2.,"Decoding was carried out in Joshua (Li et al., 2009), an open-source framework for parsing-based MT.",
1157166653,false,finalized,3,2/12/2017 18:14:12,Pos,0.7009,W11-2143,"We built a 5-gram language model from it with the SRI language modeling toolkit (Stolcke, 2002).",http://www.aclweb.org/anthology/W/W11/W11-2143.pdf,"(Stolcke, 2002)","To match the treatment given to the training data, the language model was also built in mixed case.",The final prepared corpus was made up of approximately 1.8 billion words of running text.,
1157166654,false,finalized,3,2/12/2017 18:19:03,Weak,0.3467,W11-2143,They are also larger than the 0.7- to 1.1-point gains reported by Pino et al (2010) when the full Giga-FrEn was added.,http://www.aclweb.org/anthology/W/W11/W11-2143.pdf,(2010),"The 2011 system also shows a significant reduction in the out-of-vocabulary (OOV) rate on both test sets: 38% and 47% fewer OOV types, and 44% and 45% fewer OOV tokens, when compared to the 2010 system.","Our BLEU score improvements of 1.2 to 1.9 points are statistically significant according to the paired bootstrap resampling method (Koehn, 2004) with n = 1000 and p < 0.01.",
1157166655,false,finalized,3,2/12/2017 18:14:43,CoCo,0.6866,W11-2143,"In design and construction, the system is similar to our submission from last year's workshop (Hanneman et al., 2010), with changes in the methods we employed for training data selection and SCFG filtering.",http://www.aclweb.org/anthology/W/W11/W11-2143.pdf,"(Hanneman et al., 2010)","Continuing WMT's general trend, we worked with more data than in previous years, basing our 2011 system on 13.9 million sentences of parallel French-English training data and an English language model of 1.8 billion words.",This is our fourth yearly submission to the WMT shared translation task.,
1157166656,false,finalized,3,2/12/2017 18:14:12,Pos,0.7009,W11-2143,"For generating parse trees, we used the French and English grammars of the Berkeley statistical parser (Petrov and Klein, 2007).",http://www.aclweb.org/anthology/W/W11/W11-2143.pdf,"(Petrov and Klein, 2007)","Except for minor bug fixes, our method for extracting and scoring a translation grammar remains the same as in our WMT 2010 submission.","Unidirectional word alignments were provided by MGIZA++ (Gao and Vogel, 2008), then symmetrized with the grow-diag-final-and heuristic (Koehn et al., 2005).",
1157166657,false,finalized,3,2/12/2017 19:14:18,Neut,0.6557,P10-2063,"The cross-product of the stem name and (open-class) reduced core POS tags, plus the CLOSED tag, yields 24 labels for a CRF classifier in Mallet (McCallum, 2002).",http://www.aclweb.org/anthology/P/P10/P10-2063.pdf,"(McCallum, 2002)",4 Experiments and Evaluation,"The classifier is used only to get solutions for the openclass words, although we wish to give the classifier all the words for the sentence.",
1157166658,false,finalized,3,2/12/2017 17:59:11,Neut,0.6873,P10-2063,"In contrast, other approaches have used a pipelined approach, with separate models to first do tokenization and then part-of-speech tagging (Diab et al., 2007; Diab, 2009).",http://www.aclweb.org/anthology/P/P10/P10-2063.pdf,"(Diab et al., 2007","While these approaches have somewhat lower performance than the joint approach, they have the advantage that they do not rely on the presence of a full-blown morphological analyzer, which may not always be available or appropriate as the data shifts to different genres or Arabic dialects.","1SAMA-v3.1 is an updated version of BAMA, with many significant differences in analysis.",
1157166659,false,finalized,3,2/12/2017 18:24:25,CoCo,0.6512,P10-2063,"The ""MorphPOS"" task in (Roth et al., 2008), 96.4%, is somewhat similar to ours in that it scores on a ""core tag"", but unlike for us there is only one such tag for a source token (easier) but it distinguishes between NOUN and ADJ (harder).",http://www.aclweb.org/anthology/P/P10/P10-2063.pdf,"(Roth et al., 2008)",We would like to do a direct comparison by simply runing the above systems on the exact same data and evaluating them the same way.,"However, both (Habash and Rambow, 2005; Diab et al., 2007) assume gold tokenization for evaluation of POS results, which we do not.",
